{
  "$schema": "../tokens.schema.json",
  "meta": {
    "name": "Sanity Noir",
    "mode": "dark",
    "source": "awesome-design-md/sanity"
  },
  "color": {
    "bg": "#0b0b0b",
    "bg-alt": "#212121",
    "surface": "#212121",
    "border": "#353535",
    "text": "#ffffff",
    "text-muted": "#b9b9b9",
    "text-subtle": "#797979",
    "accent": "#f36458",
    "accent-hover": "#0052ef",
    "on-accent": "#ffffff",
    "success": "#19d600",
    "warning": "#f36458",
    "danger": "#dd0000"
  },
  "font": {
    "display": "\"Space Grotesk\", \"Inter\", ui-sans-serif, system-ui, sans-serif",
    "body": "\"Inter\", ui-sans-serif, system-ui, sans-serif",
    "mono": "\"IBM Plex Mono\", ui-monospace, SFMono-Regular, monospace"
  },
  "type": {
    "display-size": "112px",
    "display-weight": 400,
    "display-tracking": "-4.48px",
    "display-line": 1.0,
    "h2-size": "32px",
    "h2-weight": 425,
    "h2-tracking": "-0.32px",
    "h2-line": 1.24,
    "body-size": "16px",
    "body-weight": 400,
    "body-line": 1.5,
    "caption-size": "13px"
  },
  "radius": {
    "input": "3px",
    "card": "6px",
    "pill": "9999px"
  },
  "space": {
    "unit": "8px",
    "section-y": "96px",
    "gutter": "32px",
    "max-width": "1440px"
  },
  "shadow": {
    "card": "0 0 0 1px #212121",
    "deep": "0 0 0 1px #353535, 0 8px 40px rgba(0,0,0,0.6)"
  }
}
